{
  "schema_version": "1.0.0",
  "record_type": "literature_source",
  "record_id": "literature_source.formalconjectures_oeis_34693_lean_exists.v1",
  "packet_id": "frontier.formal_conjectures.oeis_a34693_exists_k_best_possible.v1",
  "environment_hash": "9e26d28efe88484c36562da27aa22a2cc73a0638d11532cbbc9071a60609025d",
  "created_at": "2026-07-12T00:00:00Z",
  "trust_status": "candidate_unverified",
  "export_eligibility": "public",
  "record_hash": "45173a063cece5a54c3b7a5ed158b31a29a953e534bd39e8b1b1d143286ef744",
  "title": "FormalConjectures/OEIS/34693.lean::exists_k_best_possible",
  "authors": [],
  "publication_year": null,
  "venue": "sibling repo mnehmos.llm-driven-proof-search.environment/formal-conjectures",
  "external_ids": {
    "repo_path": "FormalConjectures/OEIS/34693.lean::exists_k_best_possible"
  },
  "source_sha256": null,
  "access_note": "Formalized from this packet's own pre-existing source_provenance.source_refs (issue #8 follow-up); not independently re-verified."
}
