{
  "schema_version": "1.0.0",
  "record_type": "literature_source",
  "record_id": "literature_source.n_2_case_not_covered_here.v1",
  "packet_id": "frontier.formal_conjectures.degiorgi_conjecture_dim_one.v1",
  "environment_hash": "9e26d28efe88484c36562da27aa22a2cc73a0638d11532cbbc9071a60609025d",
  "created_at": "2026-07-12T00:00:00Z",
  "trust_status": "candidate_unverified",
  "export_eligibility": "public",
  "record_hash": "3470a753551110a7dd5dd6ac540a908b491a6c1a0fa314a94005c03e87cd9596",
  "title": "n=2 case, not covered here",
  "authors": [
    "Ghoussoub",
    "Gui"
  ],
  "publication_year": null,
  "venue": null,
  "external_ids": {
    "url": "https://doi.org/10.1007/s002080050196"
  },
  "source_sha256": null,
  "access_note": "Formalized from this packet's own pre-existing source_provenance.source_refs (issue #8 follow-up); not independently re-verified."
}
