{
  "schema_version": "1.0.0",
  "record_type": "literature_source",
  "record_id": "literature_source.https_www_erdosproblems_com_399.v1",
  "packet_id": "frontier.erdos.erdos_399_cambie.v1",
  "environment_hash": "9e26d28efe88484c36562da27aa22a2cc73a0638d11532cbbc9071a60609025d",
  "created_at": "2026-07-12T00:00:00Z",
  "trust_status": "candidate_unverified",
  "export_eligibility": "public",
  "record_hash": "ee40fb5966198c3ba32bb4662e73f8c2dc85796677c4aee5640f678368e5e75f",
  "title": "https://www.erdosproblems.com/399",
  "authors": [],
  "publication_year": null,
  "venue": "Erdős Problems",
  "external_ids": {
    "url": "https://www.erdosproblems.com/399"
  },
  "source_sha256": null,
  "access_note": "Formalized from this packet's own pre-existing source_provenance.source_refs (issue #8 follow-up); not independently re-verified."
}
