{
  "schema_version": "1.0.0",
  "record_type": "literature_source",
  "record_id": "literature_source.formalconjectures_wikipedia_eulersumofpo_2.v1",
  "packet_id": "frontier.formal_conjectures.euler_sum_of_powers_false_for_k5.v1",
  "environment_hash": "9e26d28efe88484c36562da27aa22a2cc73a0638d11532cbbc9071a60609025d",
  "created_at": "2026-07-12T00:00:00Z",
  "trust_status": "candidate_unverified",
  "export_eligibility": "public",
  "record_hash": "5553f11e5e1b9602419b7957a52579b320647167001ae885cd131607ad18749c",
  "title": "FormalConjectures/Wikipedia/EulerSumOfPowers.lean::eulers_sum_of_powers_conjecture.false_for_k5",
  "authors": [],
  "publication_year": null,
  "venue": "sibling repo mnehmos.llm-driven-proof-search.environment/formal-conjectures",
  "external_ids": {
    "repo_path": "FormalConjectures/Wikipedia/EulerSumOfPowers.lean::eulers_sum_of_powers_conjecture.false_for_k5"
  },
  "source_sha256": null,
  "access_note": "Formalized from this packet's own pre-existing source_provenance.source_refs (issue #8 follow-up); not independently re-verified."
}
