{
  "schema_version": "1.0.0",
  "record_type": "literature_source",
  "record_id": "literature_source.https_oeis_org_a358684.v1",
  "packet_id": "frontier.formal_conjectures.oeis_a358684_conjecture_0.v1",
  "environment_hash": "9e26d28efe88484c36562da27aa22a2cc73a0638d11532cbbc9071a60609025d",
  "created_at": "2026-07-12T00:00:00Z",
  "trust_status": "candidate_unverified",
  "export_eligibility": "public",
  "record_hash": "f3272b796ca7c4de4a5f103d9a5ee7da028b136b39d60100b624749999e8f206",
  "title": "https://oeis.org/A358684",
  "authors": [],
  "publication_year": null,
  "venue": "OEIS",
  "external_ids": {
    "url": "https://oeis.org/A358684"
  },
  "source_sha256": null,
  "access_note": "Formalized from this packet's own pre-existing source_provenance.source_refs (issue #8 follow-up); not independently re-verified."
}
