{
  "schema_version": "1.0.0",
  "record_type": "literature_source",
  "record_id": "literature_source.formalconjectures_wikipedia_unionclosed_.v1",
  "packet_id": "frontier.formal_conjectures.union_closed_singleton_mem.v1",
  "environment_hash": "9e26d28efe88484c36562da27aa22a2cc73a0638d11532cbbc9071a60609025d",
  "created_at": "2026-07-12T00:00:00Z",
  "trust_status": "candidate_unverified",
  "export_eligibility": "public",
  "record_hash": "b1f22b3384837046d6f0b5eae0606049f254af39cd9c3de5d38e7199dced1f88",
  "title": "FormalConjectures/Wikipedia/UnionClosed.lean::union_closed.variants.singleton_mem",
  "authors": [],
  "publication_year": null,
  "venue": "sibling repo mnehmos.llm-driven-proof-search.environment/formal-conjectures",
  "external_ids": {
    "repo_path": "FormalConjectures/Wikipedia/UnionClosed.lean::union_closed.variants.singleton_mem"
  },
  "source_sha256": null,
  "access_note": "Formalized from this packet's own pre-existing source_provenance.source_refs (issue #8 follow-up); not independently re-verified."
}
