{
  "schema_version": "1.0.0",
  "record_type": "literature_source",
  "record_id": "literature_source.formalconjectures_paper_degiorgi_lean_de.v1",
  "packet_id": "frontier.formal_conjectures.degiorgi_conjecture_dim_one.v1",
  "environment_hash": "9e26d28efe88484c36562da27aa22a2cc73a0638d11532cbbc9071a60609025d",
  "created_at": "2026-07-12T00:00:00Z",
  "trust_status": "candidate_unverified",
  "export_eligibility": "public",
  "record_hash": "1f6000ca4b18e0060cd6eb571d59fa1815c78ed567e7767b26665ec6da0a6582",
  "title": "FormalConjectures/Paper/DeGiorgi.lean::DeGiorgi_one",
  "authors": [],
  "publication_year": null,
  "venue": "sibling repo mnehmos.llm-driven-proof-search.environment/formal-conjectures",
  "external_ids": {
    "repo_path": "FormalConjectures/Paper/DeGiorgi.lean::DeGiorgi_one"
  },
  "source_sha256": null,
  "access_note": "Formalized from this packet's own pre-existing source_provenance.source_refs (issue #8 follow-up); not independently re-verified."
}
