{
  "schema_version": "1.0.0",
  "record_type": "literature_source",
  "record_id": "literature_source.erdosproblems_erdos_1052_proof_erdos1052.v1",
  "packet_id": "frontier.erdos.erdos_1052_filter_ordcompl.v1",
  "environment_hash": "9e26d28efe88484c36562da27aa22a2cc73a0638d11532cbbc9071a60609025d",
  "created_at": "2026-07-12T00:00:00Z",
  "trust_status": "candidate_unverified",
  "export_eligibility": "public",
  "record_hash": "5e55a3cd4c383bdb7a321234ad486f89a9d20ce495c783651a106109c709923c",
  "title": "ErdosProblems/erdos-1052/proof/Erdos1052_even_of_isUnitaryPerfect.lean",
  "authors": [],
  "publication_year": null,
  "venue": "sibling repo mnehmos.llm-driven-proof-search.environment",
  "external_ids": {
    "repo_path": "ErdosProblems/erdos-1052/proof/Erdos1052_even_of_isUnitaryPerfect.lean"
  },
  "source_sha256": null,
  "access_note": "Formalized from this packet's own pre-existing source_provenance.source_refs (issue #8 follow-up); not independently re-verified."
}
