{
  "schema_version": "1.0.0",
  "record_type": "literature_source",
  "record_id": "literature_source.erdosproblems_erdos_349_proof_erdos349_o.v1",
  "packet_id": "frontier.erdos.erdos_349_one_two_is_good_pair.v1",
  "environment_hash": "9e26d28efe88484c36562da27aa22a2cc73a0638d11532cbbc9071a60609025d",
  "created_at": "2026-07-12T00:00:00Z",
  "trust_status": "candidate_unverified",
  "export_eligibility": "public",
  "record_hash": "a27d93fd0637b12824c6ff90a91ba80e7dbf37a338c55951e13a20b828a3deb3",
  "title": "ErdosProblems/erdos-349/proof/Erdos349_one_two_isGoodPair.lean",
  "authors": [],
  "publication_year": null,
  "venue": "sibling repo mnehmos.llm-driven-proof-search.environment",
  "external_ids": {
    "repo_path": "ErdosProblems/erdos-349/proof/Erdos349_one_two_isGoodPair.lean"
  },
  "source_sha256": null,
  "access_note": "Formalized from this packet's own pre-existing source_provenance.source_refs (issue #8 follow-up); not independently re-verified."
}
