{
  "schema_version": "1.0.0",
  "record_type": "literature_source",
  "record_id": "literature_source.yu2023_union_closed_bound.v1",
  "packet_id": "frontier.formal_conjectures.union_closed_sharpness.v1",
  "environment_hash": "9e26d28efe88484c36562da27aa22a2cc73a0638d11532cbbc9071a60609025d",
  "created_at": "2026-07-12T00:00:00Z",
  "trust_status": "candidate_unverified",
  "export_eligibility": "restricted",
  "record_hash": "86ec60c8a1477ee41ce8a133bbe24485b0e17b08210d3d1e42c3660cb924dbe8",
  "title": "Yu 2023 (as cited in this corpus's own authoring notes): improved general-case constant for the union-closed sets conjecture, approximately 0.38234",
  "authors": [
    "Yu"
  ],
  "publication_year": 2023,
  "venue": null,
  "external_ids": {},
  "source_sha256": null,
  "access_note": "UNVERIFIED bibliographic precision: this record formalizes a citation that already existed in the packet's own notes field prior to this retrofit (issue #7); no independent bibliography check (exact venue, DOI, full author name) was performed. Treat title/authors as a pointer to what the corpus already asserted, not a verified citation."
}
