{
  "schema_version": "1.0.0",
  "record_type": "literature_source",
  "record_id": "literature_source.erdosproblems_erdos_494_proof_erdos494_p.v1",
  "packet_id": "frontier.erdos.erdos_494_product.v1",
  "environment_hash": "9e26d28efe88484c36562da27aa22a2cc73a0638d11532cbbc9071a60609025d",
  "created_at": "2026-07-12T00:00:00Z",
  "trust_status": "candidate_unverified",
  "export_eligibility": "public",
  "record_hash": "6e45d214fcc8b06d459b9dc833b3a36c0f1cc4fb4565734bfe3578ee7aac265a",
  "title": "ErdosProblems/erdos-494/proof/Erdos494_product.lean",
  "authors": [],
  "publication_year": null,
  "venue": "sibling repo mnehmos.llm-driven-proof-search.environment",
  "external_ids": {
    "repo_path": "ErdosProblems/erdos-494/proof/Erdos494_product.lean"
  },
  "source_sha256": null,
  "access_note": "Formalized from this packet's own pre-existing source_provenance.source_refs (issue #8 follow-up); not independently re-verified."
}
