{
  "schema_version": "1.0.0",
  "record_type": "literature_source",
  "record_id": "literature_source.some_properties_of_the_factors_of_fermat.v1",
  "packet_id": "frontier.formal_conjectures.oeis_a358684_conjecture_0.v1",
  "environment_hash": "9e26d28efe88484c36562da27aa22a2cc73a0638d11532cbbc9071a60609025d",
  "created_at": "2026-07-12T00:00:00Z",
  "trust_status": "candidate_unverified",
  "export_eligibility": "public",
  "record_hash": "7c6f74f560d08d5c700c38821b50a6b9d4285fa5d85e06a78f71af77161e7960",
  "title": "Some properties of the factors of Fermat numbers (Conjecture 3.4)",
  "authors": [
    "Lorenzo Sauras-Altuzarra"
  ],
  "publication_year": 2022,
  "venue": "Art Discrete Appl. Math.",
  "external_ids": {
    "url": "https://doi.org/10.26493/2590-9770.1473.ec5"
  },
  "source_sha256": null,
  "access_note": "Formalized from this packet's own pre-existing source_provenance.source_refs (issue #8 follow-up); not independently re-verified."
}
