{
  "schema_version": "1.0.0",
  "record_type": "literature_source",
  "record_id": "literature_source.erdosproblems_erdos_349_proof_erdos349_i.v1",
  "packet_id": "frontier.erdos.erdos_349_int_coeff_ge_two_not_is_good_pair.v1",
  "environment_hash": "9e26d28efe88484c36562da27aa22a2cc73a0638d11532cbbc9071a60609025d",
  "created_at": "2026-07-12T00:00:00Z",
  "trust_status": "candidate_unverified",
  "export_eligibility": "public",
  "record_hash": "db1f2ad73e24f9a916417510bf9f5b07be49d22ff307ecf8fd13a0cc51817e40",
  "title": "ErdosProblems/erdos-349/proof/Erdos349_int_coeff_ge_two_not_isGoodPair.lean",
  "authors": [],
  "publication_year": null,
  "venue": "sibling repo mnehmos.llm-driven-proof-search.environment",
  "external_ids": {
    "repo_path": "ErdosProblems/erdos-349/proof/Erdos349_int_coeff_ge_two_not_isGoodPair.lean"
  },
  "source_sha256": null,
  "access_note": "Formalized from this packet's own pre-existing source_provenance.source_refs (issue #8 follow-up); not independently re-verified."
}
